Kategori,SubMateri,Tingkat,Pertanyaan,Pembahasan,OpsiA,SkorA,OpsiB,SkorB,OpsiC,SkorC,OpsiD,SkorD,OpsiE,SkorE
TKP,Jejaring Kerja,SULIT,"Agar program MBG sukses di desa Anda, diperlukan pasokan bahan segar setiap hari. Sebagai aparat desa, bagaimana Anda mengelola hal ini?","Pemberdayaan masyarakat sekitar.","Berkoordinasi dengan kelompok tani lokal dan penyedia jasa katering desa sebagai mitra utama.",5,"Mencari vendor besar dari luar kota agar lebih praktis.",3,"Membeli bahan baku sendiri di pasar induk setiap pagi.",4,"Menyerahkan sepenuhnya kepada kepala sekolah untuk mengatur.",2,"Meminta sumbangan dari warga untuk menutupi kekurangan logistik.",1
TKP,Sosial Budaya,SEDANG,"Beberapa siswa menolak memakan sayur dan menu MBG karena tidak sesuai dengan selera makanan modern yang sering mereka beli. Langkah edukatif Anda?","Melakukan pendekatan persuasif.","Memberikan pemahaman yang menarik tentang pentingnya gizi seimbang bagi tubuh mereka.",5,"Memaksa mereka makan dengan ancaman pengurangan nilai.",1,"Menelepon orang tua mereka agar memarahi anak-anaknya.",3,"Membiarkan mereka tidak makan asalkan mereka diam di kelas.",2,"Mengusulkan agar menu diganti dengan makanan cepat saji sesekali.",4
TKP,TIK,MUDAH,"Proses pelaporan harian program MBG mengharuskan upload foto setiap hari yang membuat memori HP para guru penuh. Solusi TIK yang tepat yang bisa Anda usulkan adalah...","Penggunaan cloud/sistem yang efisien.","Membuat sistem form online yang langsung menyimpan foto ke penyimpanan awan (cloud) instansi.",5,"Menyarankan para guru membeli HP baru dengan memori besar.",2,"Mengabaikan pelaporan foto dan hanya mengirim teks.",1,"Mengumpulkan foto dalam flashdisk dan dikirim seminggu sekali.",4,"Meminta anggaran khusus untuk membeli kamera bagi setiap sekolah.",3
TKP,Profesionalisme,SULIT,"Terjadi miskomunikasi antara pihak sekolah, komite sekolah, dan vendor mengenai jam pengantaran MBG yang mengganggu jam pelajaran. Sebagai penanggung jawab program, Anda akan...","Menjadi problem solver.","Mengumpulkan ketiga pihak untuk mengevaluasi jadwal dan mencari kesepakatan waktu yang ideal.",5,"Menyalahkan vendor karena tidak mengikuti jadwal sekolah.",3,"Menyuruh komite sekolah yang menyelesaikan masalah tersebut.",2,"Membuat aturan baru secara sepihak dan memaksa semua patuh.",4,"Membiarkan jam pelajaran terganggu asalkan program tetap jalan.",1
TKP,Pelayanan Publik,SEDANG,"Dalam pelaksanaan MBG, Anda mendapati ada anak yang memiliki alergi parah terhadap salah satu menu wajib hari itu (misal: telur). Apa yang segera Anda lakukan?","Memberikan pelayanan inklusif dan aman.","Memastikan anak tersebut tidak mengonsumsi menu itu dan segera mencarikan makanan pengganti yang aman.",5,"Menyuruh anak tersebut berpuasa hari itu.",1,"Menyuruhnya membuang telurnya saja dan makan nasinya.",3,"Menelepon orang tuanya untuk segera menjemput anak tersebut.",2,"Memberikannya uang saku agar ia jajan di kantin.",4
TKP,Sosial Budaya,SULIT,"Desa Anda mendapat apresiasi sebagai pelaksana MBG terbaik. Namun, desa tetangga merasa cemburu dan menuduh adanya manipulasi data. Respons Anda sebagai perangkat desa?","Menanggapi dengan bijak dan terbuka.","Mengundang perwakilan desa tetangga untuk melihat langsung transparansi proses pelaksanaan di desa Anda.",5,"Membalas tuduhan tersebut dengan membongkar keburukan desa tetangga.",1,"Mengabaikan tuduhan dan merayakan kemenangan bersama warga.",4,"Melaporkan desa tetangga ke polisi atas tuduhan pencemaran nama baik.",2,"Mengembalikan penghargaan tersebut untuk menghindari konflik panjang.",3
TKP,TIK,SEDANG,"Anda membuat dashboard sederhana menggunakan Excel untuk memantau status gizi anak setelah 3 bulan program MBG berjalan. Atasan sangat terkesan dan meminta Anda mempresentasikannya ke dinas. Anda akan...","Proaktif dan profesional.","Menyempurnakan visualisasi data di dashboard tersebut dan mempersiapkan presentasi dengan baik.",5,"Menolak karena merasa itu bukan tugas utama saya.",1,"Memberikan file Excel tersebut kepada atasan agar beliau saja yang presentasi.",3,"Meminta tambahan gaji/bonus sebelum melakukan presentasi.",2,"Mempresentasikan seadanya karena atasan sudah terkesan.",4
